<?xml version="1.0" encoding="UTF-8"?>
<CRANEcollectorConfiguration xmlns:xsi="http://www.w3.org/2001/XMLSchema-instance" xsi:noNamespaceSchemaLocation="CRANEcollector.xsd">
  <Clients>
    <Client>
      <IP>192.168.69.20</IP>
      <Port>17000</Port>
      <VerPort>17000</VerPort>
      <VendorString/>
      <CnctTO>5000</CnctTO>
      <CnctRetryTO>2000</CnctRetryTO>
      <RecnctItvl>10000</RecnctItvl>
      <CnctRndtrpTO>2000</CnctRndtrpTO>
      <AckLogItvl>60000</AckLogItvl>
      <Desc/>
      <Sessions/>
    </Client>
  </Clients>
  <Templates/>
  <ConfigurationVersion>1</ConfigurationVersion>
  <ServerIPAddress/>
  <ServerPort>15001</ServerPort>
  <ServerAckInterval>1000</ServerAckInterval>
  <ServerStartInterval>10</ServerStartInterval>
  <EnableDebugMsg>false</EnableDebugMsg>
</CRANEcollectorConfiguration>
